{
  "bank_version": "0.1.0",
  "domain_id": "dsa",
  "slice_id": "running-extrema",
  "graph_version": "0.1.0",
  "items": [
    {
      "id": "re.compare.001",
      "version": "0.1.0",
      "title": "Choose the running maximum update",
      "task_mode": "state_prediction",
      "primary_competency_id": "dsa.compare.values",
      "competency_ids": ["dsa.compare.values"],
      "exposure_class": "diagnostic",
      "assistance_ceiling": "A0",
      "learning_operation": "predict",
      "representation_families": ["text_state"],
      "complexity": {"prerequisite_depth": 0, "state_variables": 1, "control_flow": 1, "syntax_load": 0, "representation_translation": 0, "surface_novelty": 0, "scaffold_amount": 0, "transfer_distance": 0},
      "grader": {"type": "exact_state", "reference": "running_extrema.compare.001"},
      "prompt": "Current maximum is 8. The next value is 11. Predict the new maximum and state the comparison that justifies the update.",
      "expected_evidence": ["selected candidate value", "comparison direction"]
    },
    {
      "id": "re.running-max.001",
      "version": "0.1.0",
      "title": "Trace one running maximum",
      "task_mode": "code_trace",
      "primary_competency_id": "dsa.extrema.running_max",
      "competency_ids": ["dsa.compare.values", "dsa.extrema.running_max", "dsa.state.predict_transition"],
      "exposure_class": "practice",
      "assistance_ceiling": "A1",
      "learning_operation": "trace",
      "representation_families": ["state_table", "python_code"],
      "complexity": {"prerequisite_depth": 1, "state_variables": 1, "control_flow": 1, "syntax_load": 1, "representation_translation": 1, "surface_novelty": 0, "scaffold_amount": 1, "transfer_distance": 0},
      "grader": {"type": "exact_state", "reference": "running_extrema.running_max.001"},
      "prompt": "Trace max_so_far across [4, 9, 2, 12, 7]. Record the state after each value without executing code.",
      "expected_evidence": ["complete prefix state sequence", "persistent running candidate"]
    },
    {
      "id": "re.index-value.001",
      "version": "0.1.0",
      "title": "Find the index/value confusion",
      "task_mode": "debug_existing_code",
      "primary_competency_id": "py.index_value.distinguish",
      "competency_ids": ["py.index_value.distinguish"],
      "exposure_class": "diagnostic",
      "assistance_ceiling": "A0",
      "learning_operation": "debug",
      "representation_families": ["python_code"],
      "complexity": {"prerequisite_depth": 0, "state_variables": 1, "control_flow": 1, "syntax_load": 2, "representation_translation": 1, "surface_novelty": 1, "scaffold_amount": 0, "transfer_distance": 0},
      "grader": {"type": "manual_rubric", "reference": "running_extrema.index_value.001"},
      "prompt": "A loop uses `for i in range(len(nums))` and compares `i > largest` when the goal is to track the largest value. Identify the bug and describe the minimal correction.",
      "expected_evidence": ["distinguishes position from element value", "corrected comparison target"]
    },
    {
      "id": "re.two-candidate.001",
      "version": "0.1.0",
      "title": "Predict a two-candidate transition",
      "task_mode": "state_prediction",
      "primary_competency_id": "dsa.extrema.two_candidates",
      "competency_ids": ["dsa.state.predict_transition", "dsa.extrema.two_candidates"],
      "exposure_class": "diagnostic",
      "assistance_ceiling": "A0",
      "learning_operation": "predict",
      "representation_families": ["state_tuple"],
      "complexity": {"prerequisite_depth": 2, "state_variables": 2, "control_flow": 2, "syntax_load": 0, "representation_translation": 0, "surface_novelty": 0, "scaffold_amount": 0, "transfer_distance": 0},
      "grader": {"type": "exact_state", "reference": "running_extrema.two_candidate.001"},
      "prompt": "Before reading the next value, `(largest, second) = (10, 7)`. The next value is 13. Predict the next tuple and explain which old value must be preserved.",
      "expected_evidence": ["correct next tuple", "preserves prior largest"]
    },
    {
      "id": "re.invariant.001",
      "version": "0.1.0",
      "title": "Explain the prefix invariant",
      "task_mode": "verbal_explanation",
      "primary_competency_id": "dsa.invariant.two_largest_order",
      "competency_ids": ["dsa.extrema.two_candidates", "dsa.invariant.two_largest_order"],
      "exposure_class": "practice",
      "assistance_ceiling": "A1",
      "learning_operation": "explain",
      "representation_families": ["causal_text", "state_tuple"],
      "complexity": {"prerequisite_depth": 3, "state_variables": 2, "control_flow": 1, "syntax_load": 0, "representation_translation": 1, "surface_novelty": 0, "scaffold_amount": 1, "transfer_distance": 0},
      "grader": {"type": "manual_rubric", "reference": "running_extrema.invariant.001"},
      "prompt": "State what `largest` and `second` must mean after every processed prefix, not just after the loop finishes. Explain why that statement is useful for checking updates.",
      "expected_evidence": ["prefix-scoped invariant", "ordered candidate meaning", "connection to update correctness"]
    },
    {
      "id": "re.update-order.001",
      "version": "0.1.0",
      "title": "Order the new-maximum updates",
      "task_mode": "parsons_completion",
      "primary_competency_id": "dsa.extrema.update_order",
      "competency_ids": ["dsa.extrema.two_candidates", "dsa.invariant.two_largest_order", "dsa.extrema.update_order"],
      "exposure_class": "practice",
      "assistance_ceiling": "A2",
      "learning_operation": "reconstruct",
      "representation_families": ["parsons_blocks", "state_tuple"],
      "complexity": {"prerequisite_depth": 4, "state_variables": 2, "control_flow": 2, "syntax_load": 1, "representation_translation": 2, "surface_novelty": 0, "scaffold_amount": 2, "transfer_distance": 0},
      "grader": {"type": "parsons_order", "reference": "running_extrema.update_order.001"},
      "prompt": "Arrange the update actions for the branch where `x > largest` so the previous maximum is not lost: `largest = x` and `second = largest`.",
      "expected_evidence": ["correct dependency order", "recognizes clobber risk"]
    },
    {
      "id": "re.update-order.002",
      "version": "0.1.0",
      "title": "Debug clobbered candidate state",
      "task_mode": "debug_existing_code",
      "primary_competency_id": "dsa.extrema.update_order",
      "competency_ids": ["dsa.state.predict_transition", "dsa.invariant.two_largest_order", "dsa.extrema.update_order"],
      "exposure_class": "diagnostic",
      "assistance_ceiling": "A0",
      "learning_operation": "debug",
      "representation_families": ["python_code", "state_table"],
      "complexity": {"prerequisite_depth": 4, "state_variables": 2, "control_flow": 2, "syntax_load": 2, "representation_translation": 2, "surface_novelty": 1, "scaffold_amount": 0, "transfer_distance": 0},
      "grader": {"type": "manual_rubric", "reference": "running_extrema.update_order.002"},
      "prompt": "Buggy code executes `largest = x` before `second = largest` when a new maximum arrives. Use one concrete state transition to show the corruption and specify the fix.",
      "expected_evidence": ["counterexample trace", "identifies overwritten prior maximum", "correct update order"]
    },
    {
      "id": "re.implement.001",
      "version": "0.1.0",
      "title": "Implement distinct second-largest",
      "task_mode": "manual_code_blank",
      "primary_competency_id": "dsa.extrema.second_largest_implement",
      "competency_ids": ["py.index_value.distinguish", "dsa.extrema.two_candidates", "dsa.invariant.two_largest_order", "dsa.extrema.update_order", "dsa.extrema.second_largest_implement"],
      "exposure_class": "practice",
      "assistance_ceiling": "A1",
      "learning_operation": "translate",
      "representation_families": ["python_code"],
      "complexity": {"prerequisite_depth": 5, "state_variables": 2, "control_flow": 3, "syntax_load": 3, "representation_translation": 3, "surface_novelty": 0, "scaffold_amount": 0, "transfer_distance": 0},
      "grader": {"type": "python_tests", "reference": "running_extrema.second_largest.distinct.v0_1"},
      "prompt": "Write a one-pass Python function that returns the second-largest distinct value. State how duplicates are handled and what happens when fewer than two distinct values exist.",
      "expected_evidence": ["correct one-pass candidate updates", "explicit duplicate policy", "handles insufficient distinct values"]
    },
    {
      "id": "re.transfer.001",
      "version": "0.1.0",
      "title": "Transfer to two smallest values",
      "task_mode": "verbal_explanation",
      "primary_competency_id": "dsa.invariant.two_largest_order",
      "competency_ids": ["dsa.compare.values", "dsa.extrema.two_candidates", "dsa.invariant.two_largest_order", "dsa.extrema.update_order"],
      "exposure_class": "transfer_public_fixture",
      "assistance_ceiling": "A0",
      "learning_operation": "transfer",
      "representation_families": ["causal_text"],
      "complexity": {"prerequisite_depth": 4, "state_variables": 2, "control_flow": 2, "syntax_load": 0, "representation_translation": 2, "surface_novelty": 3, "scaffold_amount": 0, "transfer_distance": 3},
      "grader": {"type": "manual_rubric", "reference": "running_extrema.transfer.two_smallest.001"},
      "prompt": "Without writing code, derive how the invariant and update conditions change if the goal becomes the two smallest distinct values instead of the two largest.",
      "expected_evidence": ["comparison direction transfer", "preserved two-candidate structure", "updated invariant"]
    },
    {
      "id": "re.transfer.002",
      "version": "0.1.0",
      "title": "Derive a third-largest extension",
      "task_mode": "ai_oversight_review",
      "primary_competency_id": "dsa.extrema.second_largest_implement",